{
  "schemaVersion": 2,
  "taskId": "demo-metro-synthetic",
  "title": "[Synthetic] Metro Procedure Demonstration",
  "summary": "Synthetic 13-step procedure demonstrating the Civic Metro visualization with multiple layers and branches.",
  "jurisdiction": {
    "country": "IN",
    "state": "Maharashtra",
    "city": "Mumbai",
    "localBody": "Example Municipal Corporation",
    "ward": "H West"
  },
  "category": "food_and_hospitality",
  "keywords": [
    "synthetic",
    "metro",
    "demo",
    "cloud kitchen",
    "food business",
    "fssai",
    "mcgm",
    "fire safety",
    "trade licence"
  ],
  "eligibility": [
    "Applicant must hold lawful possession of commercial premises in Mumbai"
  ],
  "questions": [
    {
      "id": "q-large-area",
      "text": "Is the establishment area greater than 100 square meters?",
      "help": "Determines whether on-site fire department physical clearance is required."
    },
    {
      "id": "q-commercial-power",
      "text": "Do you require a high-tension commercial power line?",
      "help": "Select yes if your kitchen equipment load exceeds 20kW."
    },
    {
      "id": "q-heritage-zone",
      "text": "Is the premise located within a declared heritage conservation zone?",
      "help": "Heritage precincts require special conservation committee concurrence."
    }
  ],
  "nodes": [
    {
      "id": "s01-portal-signup",
      "title": "[Synthetic] Online Portal Registration",
      "description": "Register account on civic portal and submit basic application profile.",
      "department": "Example IT Department",
      "requirement": {
        "kind": "mandatory"
      },
      "mode": "online",
      "officeType": "online_portal",
      "forms": [
        {
          "name": "Registration Form",
          "code": "SYN-01",
          "url": "https://www.india.gov.in/"
        }
      ],
      "documents": [
        {
          "name": "PAN Card",
          "acceptedFormats": [
            "PDF"
          ],
          "maxSizeKB": 1024
        }
      ],
      "fee": {
        "kind": "free"
      },
      "processingTime": {
        "kind": "estimate",
        "minDays": 0,
        "maxDays": 1,
        "dayType": "working"
      },
      "sources": [
        {
          "url": "https://www.india.gov.in/",
          "title": "National Portal",
          "kind": "portal",
          "retrievedOn": "2026-09-26"
        }
      ],
      "review": {
        "status": "verified",
        "verifiedOn": "2026-09-26"
      }
    },
    {
      "id": "s02-zonal-clearance",
      "title": "[Synthetic] Ward Office Zonal Clearance",
      "description": "Ward scrutiny of land use and commercial zoning compliance.",
      "department": "Example Ward Office",
      "requirement": {
        "kind": "mandatory"
      },
      "mode": "in_person",
      "officeType": "ward_office",
      "office": {
        "name": "Example Ward Office H-West",
        "address": "Hill Road, Bandra, Mumbai",
        "lat": 19.0596,
        "lng": 72.8295,
        "hours": "10:00 - 17:00"
      },
      "forms": [],
      "documents": [
        {
          "name": "Rent Agreement",
          "acceptedFormats": [
            "PDF"
          ],
          "maxSizeKB": 4096
        }
      ],
      "fee": {
        "kind": "fixed",
        "amountINR": 500,
        "recurrence": "annual"
      },
      "processingTime": {
        "kind": "estimate",
        "minDays": 2,
        "maxDays": 4,
        "dayType": "working"
      },
      "sources": [
        {
          "url": "https://www.india.gov.in/",
          "title": "Ward Guidelines",
          "kind": "guideline",
          "retrievedOn": "2026-09-26"
        }
      ],
      "review": {
        "status": "verified",
        "verifiedOn": "2026-09-26"
      }
    },
    {
      "id": "s03-noc-heritage",
      "title": "[Synthetic] Heritage Conservation Scrutiny",
      "description": "Review of external facade and structural modifications by heritage board.",
      "department": "Example Heritage Committee",
      "requirement": {
        "kind": "conditional",
        "condition": "Premises located within heritage conservation zone",
        "appliesWhen": {
          "questionId": "q-heritage-zone",
          "answer": true
        }
      },
      "mode": "hybrid",
      "officeType": "court_or_notary",
      "office": {
        "name": "Example Heritage Advisory Cell",
        "address": "Fort Precinct, Mumbai",
        "lat": 18.9322,
        "lng": 72.834
      },
      "forms": [],
      "documents": [],
      "fee": {
        "kind": "fixed",
        "amountINR": 250,
        "recurrence": "one_time"
      },
      "processingTime": {
        "kind": "estimate",
        "minDays": 3,
        "maxDays": 7,
        "dayType": "calendar"
      },
      "sources": [
        {
          "url": "https://example.com/heritage-rules",
          "title": "Heritage Portal",
          "kind": "guideline",
          "retrievedOn": "2026-09-26"
        }
      ],
      "review": {
        "status": "unverified"
      }
    },
    {
      "id": "s04-fire-inspection",
      "title": "[Synthetic] Physical Fire Safety Inspection",
      "description": "On-site assessment of kitchen gas lines, fire exits and extinguishers.",
      "department": "Example Fire Services",
      "requirement": {
        "kind": "conditional",
        "condition": "Premises area exceeds 100 square meters",
        "appliesWhen": {
          "questionId": "q-large-area",
          "answer": true
        }
      },
      "mode": "in_person",
      "officeType": "fire_services",
      "office": {
        "name": "Example Fire Brigade Headquarters",
        "address": "Marol, Andheri East, Mumbai",
        "lat": 19.1136,
        "lng": 72.8697
      },
      "forms": [],
      "documents": [],
      "fee": {
        "kind": "variable",
        "note": "Calculated based on floor area and equipment load"
      },
      "processingTime": {
        "kind": "estimate",
        "minDays": 3,
        "maxDays": 5,
        "dayType": "working"
      },
      "sources": [
        {
          "url": "https://example.com/fire-act",
          "title": "Fire Safety Code",
          "kind": "act_or_rule",
          "retrievedOn": "2026-09-26"
        }
      ],
      "review": {
        "status": "flagged",
        "note": "Unofficial source pending municipal gazette verification"
      }
    },
    {
      "id": "s05-small-declaration",
      "title": "[Synthetic] Small Kitchen Self-Declaration",
      "description": "Self-certified compliance submission for micro kitchens under 100 sqm.",
      "department": "Example Fire Services",
      "requirement": {
        "kind": "conditional",
        "condition": "Premises area does not exceed 100 square meters",
        "appliesWhen": {
          "questionId": "q-large-area",
          "answer": false
        }
      },
      "mode": "online",
      "officeType": "online_portal",
      "forms": [],
      "documents": [],
      "fee": {
        "kind": "free"
      },
      "processingTime": {
        "kind": "estimate",
        "minDays": 1,
        "maxDays": 2,
        "dayType": "working"
      },
      "sources": [
        {
          "url": "https://www.india.gov.in/",
          "title": "Self Declaration Format",
          "kind": "form",
          "retrievedOn": "2026-09-26"
        }
      ],
      "review": {
        "status": "verified",
        "verifiedOn": "2026-09-26"
      }
    },
    {
      "id": "s06-power-assessment",
      "title": "[Synthetic] High-Tension Power Assessment",
      "description": "Feasibility and substation capacity check for commercial power load.",
      "department": "Example Electricity Distribution",
      "requirement": {
        "kind": "conditional",
        "condition": "High-tension power line required for commercial kitchen",
        "appliesWhen": {
          "questionId": "q-commercial-power",
          "answer": true
        }
      },
      "mode": "in_person",
      "officeType": "utility_provider",
      "office": {
        "name": "Example Power Substation Office",
        "address": "Dadar West, Mumbai",
        "lat": 19.0178,
        "lng": 72.8478
      },
      "forms": [],
      "documents": [],
      "fee": {
        "kind": "range",
        "minINR": 1200,
        "maxINR": 3500,
        "recurrence": "one_time"
      },
      "processingTime": {
        "kind": "estimate",
        "minDays": 5,
        "maxDays": 10,
        "dayType": "working"
      },
      "sources": [
        {
          "url": "https://example.com/utility-tariffs",
          "title": "Commercial Tariffs",
          "kind": "fee_schedule",
          "retrievedOn": "2026-09-26"
        }
      ],
      "review": {
        "status": "unverified"
      }
    },
    {
      "id": "s07-labour-registration",
      "title": "[Synthetic] Commercial Establishment Registration",
      "description": "Registration of establishment under the state shops and commercial act.",
      "department": "Example Labour Department",
      "requirement": {
        "kind": "mandatory"
      },
      "mode": "hybrid",
      "officeType": "labour_department",
      "forms": [],
      "documents": [],
      "fee": {
        "kind": "fixed",
        "amountINR": 300,
        "recurrence": "annual"
      },
      "processingTime": {
        "kind": "unknown"
      },
      "sources": [
        {
          "url": "https://www.india.gov.in/",
          "title": "Labour Ministry Portal",
          "kind": "portal",
          "retrievedOn": "2026-09-26"
        }
      ],
      "review": {
        "status": "verified",
        "verifiedOn": "2026-09-26"
      }
    },
    {
      "id": "s08-health-sanitation",
      "title": "[Synthetic] Health and Sanitation NOC",
      "description": "Inspection of food handling, potable water supply and waste disposal.",
      "department": "Example Public Health Department",